{
  "schema_version": "1.0",
  "task": "task-name-here",
  "timestamp": "2026-06-23T10:00:00Z",
  "status": "PASS",
  "checks": [
    {
      "check": "compile",
      "command": "cargo check -p crate-name --lib",
      "status": "PASS",
      "warnings": 0,
      "errors": 0,
      "details": ""
    },
    {
      "check": "test",
      "command": "cargo test -p crate-name --lib",
      "status": "PASS",
      "tests_run": 15,
      "tests_passed": 15,
      "tests_failed": 0,
      "details": ""
    },
    {
      "check": "boundary",
      "status": "PASS",
      "no_touch_violations": [],
      "can_modify_compliance": true,
      "details": ""
    }
  ],
  "recommendation": "READY_FOR_REVIEW"
}
